,comment,sentiment_label
26832,分配不好今年传媒影视机构分析整体不乐观天神娱乐天神娱乐,-1
26839,天天阴跌，不知是怎么回事天天阴跌，不知是怎么回事,-1
26844,第二波快来第二波快来,1
26848,就这样熄火了么？就这样熄火了么？,-1
26854,还好卖了。8.58出了还好卖了。8.58出了,-1
26858,垃圾股走了垃圾股走了,-1
26895,鸡年来了一个开门红，好兆头再次关注爱司凯,1
26896,我的哥你是咋得了非要等所谓垃圾养老金入股吗。我的哥你是咋得了非要等所谓垃圾养老金入股吗。,-1
26921,光线，终于向华谊低下高昂的头，继续自己的跟班跑龙套的路！光线，终于向华谊低下高昂的头，继续自己的跟班跑龙套的路！,-1
26928,cao，华谊红了，你搞什么？cao，华谊红了，你搞什么？,-1
26945,光线真是没救没救了，我感觉被王总给骗了，越持有赔得越多…光线真是没救没救了，我感觉被王总给骗了，越持有赔得越多…,-1
26968,中国保监会召开紧急会议如何将高送转与业绩匹配的问题落到实处呢？关键有两点,-1
26984,所谓的真相别动不动就拖自己不会看吗？,-1
27005,看你能跌倒哪里去，永远先进后出，大盘涨了补仓t，8.32补仓完毕，赶快涨吧看你能跌倒哪里去，永远先进后出，大盘涨了补仓t，8.32补仓完毕，赶快涨吧,1
27015,新丽重新递交上市就在今天下午，新丽传媒董秘办人士对娱乐资本论独家回应：“撤回申请材料，只是为了准备重新申报。”,1
27018,涨停我就把早上买的出了，哈哈哈哈涨停我就把早上买的出了，哈哈哈哈,1
27030,漂亮继续涨涨涨，我就是不动，看见的肯定吓得都卖了，涨停就我赚漂亮继续涨涨涨，我就是不动，看见的肯定吓得都卖了，涨停就我赚,1
27035,继续先进后出，保证飞不了继续先进后出，保证飞不了,1
27051,都不信涨了，我信，继续加仓都不信涨了，我信，继续加仓,-1
27079,真他妈的差，跌的时候比华策、华谊跌得多，涨的时候又比他们涨的慢，看[空仓][减真他妈的差，跌的时候比华策、华谊跌得多，涨的时候又比他们涨的慢，看,-1
27081,主升浪可以有空中加油，板块趋势行情难见龙头变换！主升浪可以有空中加油，板块趋势行情难见龙头变换！,1
27083,看看华策!!看看华策!!看看华策!!看看华策!!狗屎一样的!!看看华策!!狗屎一样的!!看看华策!!狗屎一样的!!,-1
27094,W走势，信不信由你！W走势，信不信由你！,-1
27096,这烂股，绝不是散户持股多的原因是有人刻意做空,-1
27097,跟着长知识了！！！冀东我也有参与，27日进的3日出跟着长知识了！！！冀东我也有参与，27日进的3日出,1
27104,光线你涨起来吧！割肉别的买的你呀！加油加油光线你涨起来吧！割肉别的买的你呀！加油加油,1
27107,"股东大会决议公告里有反对83,800股，我是在交易系统里进行网络投反对票的，持股股东大会决议公告里有反对83,800股，我是在交易系统里进行网络投反对票的，持股250000多，这是个什么情况？不计入投票吗？",-1
27115,几万手压单，主力又在吓唬人了都是港通，怎么差距就这么大呢,-1
27122,如此阴跌，说明什么？熬不住了，出！从此戒光线传媒，买一次伤心一次！如此阴跌，说明什么？熬不住了，出！从此戒光线传媒,-1
27125,猫眼，淘票票，娱票儿市场竞争必将3变2，我觉得猫眼最有可能被淘宝和看中！,1
27130,8.88加仓，如还是亏，也没办法了。买买,-1
27161,吃了屎一样恶心，卖了华策买了光线！妈的，连亏损的华谊都涨不过！！！吃了屎一样恶心，卖了华策买了光线！妈的，连亏损的华谊都涨不过！！！,-1
27170,垃圾垃圾,-1
27178,新丽传媒基本IPO无望，上面政策是严管文化和服务类的IPO[失望]，你们等待的新新丽传媒基本IPO无望，上面政策是严管文化和服务类的IPO,-1
27180,这是明智的选择这是很有必要的,1
27183,新丽IPO泡汤，光线也完蛋了，补跌跌,-1
27198,光线传媒:2017年度第一季度业绩预告公告日期：2017-04-07北京光线传媒股份有限公司[查看历史公告]提示：本网不保证其真实性和客观性，一切有关该股的有效信息，以交易所的公告为准，敬请投资者注意风险。,1
27206,光线电影重返狼群6.16隆重上映王长田,1
27207,今天早盘趁着诱多出了！好兴奋今天早盘趁着诱多出了！好兴奋,-1
27208,明天见证奇迹，破八之日已到。明天见证奇迹，破八之日已到。,1
27237,利好丨4月14日晚间上市公司利好公告一览董藩：房地长行业仍然是最好的投资方式,1
27249,王长田他爹死的早，所以天天想跌烂货,-1
27268,拉起时看起来毫不费力拉起时看起来毫不费力,1
27282,光线传媒:关于控股股东部分股份质押的公告公告日期：2017-05-25北京光线传媒股份有限公司[查看历史公告]提示：本网不保证其真实性和客观性，一切有关该股的有效信息，以交易所的公告为准，敬请投资者注意风险。,1
27301,公司以1.52亿元将清远市房产出售给广州市大洋房地产公司一是要堵住漏洞,-1
27306,今年预计参投及主发票房八十亿，不实际吧，总共计划才上映十部，每部平均要达八亿了今年预计参投及主发票房八十亿，不实际吧，总共计划才上映十部，每部平均要达八亿了,-1
27323,拉升放套中，等着坑更多的人，六月目标破七拉升放套中，等着坑更多的人，六月目标破七,-1
27324,那还不如不抛等大级别的卖点再说要买进那些股价正在下跌的股票而不是正在上涨的股票,-1
27330,日线指标MACD背离了，也不敢加仓。日线指标MACD背离了，也不敢加仓。,-1
27332,三条均线压制，冲不过去的！老王还能勃起吗？,-1
27337,光线传媒:独立董事对关联交易事项的事前认可意见公告日期：2017-05-31北京光线传媒股份有限公司[查看历史公告]提示：本网不保证其真实性和客观性，一切有关该股的有效信息，以交易所的公告为准，敬请投资者注意风险。,1
27338,光线传媒:独立董事对相关事项发表的独立意见公告日期：2017-05-31北京光线传媒股份有限公司[查看历史公告]提示：本网不保证其真实性和客观性，一切有关该股的有效信息，以交易所的公告为准，敬请投资者注意风险。,1
27350,这是什么垃圾股呀？这是什么垃圾股呀？,-1
27351,持这垃圾股一年多了，亏了30%多！！！持这垃圾股一年多了，亏了30%多！！！,-1
27352,最近召开的中央工作会议明确表示上市资格都保不住,-1
27357,软骨头，一点都对不起光线这优质股！fuck！软骨头，一点都对不起光线这优质股！fuck！,-1
27361,你要跌回2元吗？赶快把你收购的那些垃圾卖了换钱吧。你要跌回2元吗？赶快把你收购的那些垃圾卖了换钱吧。,-1
27364,这烂股主力都他妈偷人生的这烂股主力都他妈偷人生的,-1
27374,寻求帮助寻求帮助,1
27376,能有效判断股票的行情性质与趋势特别是涨停数量远超过涨5%,1
27385,进场就赚5900可以[赞]进场就赚5900可以,1
27387,垃圾大王垃圾大王,-1
27394,光线传媒在保定雄安新区有个子公司！牛B！很有战略眼光啊！光线传媒,1
27395,盘面上看要重视筹码分布密集区域,-1
27399,光线传媒：1.3亿转让捷通无限股权优化资源配置来源：证券时报　　光线传媒(300251)5月31日晚公告，因捷通无限的主营与天津猫眼相近，公司拟将持有的捷通无限68.55%的股权，以1.3亿元转让给天津猫眼。因公司控股股东光线控股持有天津猫眼38.4%股权，公司持有天津猫眼19%股权，此次交易构成关联交易。捷通无限旗下的“网票网”是电影行业的电商整合平台及电子票务运营平台，为用户提供一站式的观影服务。此次交易有助于优化公司资源配置。（来源：证券时报2017-05-3119:55）[点击查看原文],1
27403,今天进的赚13000多了，确实好股无疑，大家为什么老说不好呢？哈哈哈！时间紧的好今天进的赚13000多了，确实好股无疑，大家为什么老说不好呢？哈哈哈！时间紧的好,1
27416,技术上看指数在短期如果没有利好带动将继续做底部昨天追高买入,1
27419,IPO近期基本一天买盘不济（缩量）造成了股指欲振乏力,-1
27428,光线传媒:关于控股股东部分股份质押的公告公告日期：2017-06-05北京光线传媒股份有限公司[查看历史公告]提示：本网不保证其真实性和客观性，一切有关该股的有效信息，以交易所的公告为准，敬请投资者注意风险。,1
27431,王长田为什么不出来兜底[加油]王长田为什么不出来兜底,-1
27432,光线传媒:关于归还募集资金的公告公告日期：2017-06-06北京光线传媒股份有限公司[查看历史公告]提示：本网不保证其真实性和客观性，一切有关该股的有效信息，以交易所的公告为准，敬请投资者注意风险。,1
27437,漂亮，赚一分就是900块呀，块涨快涨漂亮，赚一分就是900块呀，块涨快涨,1
27438,创新高漂亮漂亮创新高漂亮漂亮,1
27443,为什么那么多散户唱多.真是太有耐心了。主力都怕了你们了。都不敢做空了。为什么那么多散户唱多.真是太有耐心了。主力都怕了你们了。都不敢做空了。,-1
27444,喊涨的别叫了，你是嫌丑吗？我都赚30000多了，也没像你这么得瑟啊！可以了，安静喊涨的别叫了，你是嫌丑吗？我都赚30000多了，也没像你这么得瑟啊！可以了，安静的等他涨,1
27449,马上冲上8.3盈利可真快，这真是千里江陵一日还马上冲上8.3盈利可真快，这真是千里江陵一日还,1
27451,光线传媒的董秘肯定是吃翔吃多了我见过最垃圾的董秘对待投资者提问从来不及时,-1
27454,几日不见，股价快赶上华谊了跌的慢，涨的慢，没人气,-1
27455,恒大应该是财务投资者，买入股权不超过30%，不构成举牌。恒大应该是财务投资者，买入股权不超过30%，不构成举牌，另外估计还没到5%，所以没公告，静待消息。,-1
27465,王总的意思是：新梅（新丽传媒）要兑现了？这微博发的真是让人寻味，同时股价走到不涨就崩的地步，奇怪的是日、60、30、15威廉全部没空间，感觉有事要发生,-1
27468,每天都爹，烦不烦啊每天都爹，烦不烦啊,-1
27485,看看新丽传媒，光线醉了！大闹天竺的票房不如预期，给光线很大打击。但光线2017年说不定却好事连连，别的不说单说投资占27.6%的新丽传媒就让光线传媒光线传媒,-1
27488,非常棒的形态小散们知道该怎么做了？,1
27494,长田及庄家，绿帽继续戴！一定要戴好戴正！长田及庄家，绿帽继续戴！一定要戴好戴正！,-1
27496,麻了个必的，垃圾公司，垃圾电影，垃圾市值管理公司，别让我看见你们这群垃圾，只会坑麻了个必的，垃圾公司，垃圾电影，垃圾市值管理公司，别让我看见你们这群垃圾，只会坑散户,-1
27498,又是套路，真是赚钱没良心[怒]又是套路，真是赚钱没良心,-1
27515,光线被套的，等到2023年可以解套牛市，10年一次,1
27519,大闹天竺，打不死的小强啊，每天慢慢悠悠往上爬大闹天竺，打不死的小强啊，每天慢慢悠悠往上爬,-1
27521,7.05139亿！宝宝加油！顶起！7.05139亿！宝宝加油！顶起！,1
27525,有意思，每天都是0.1[微笑]有意思，每天都是0.1,1
27528,死光线，发莓死光线，发莓,-1
27529,原本是近期热点，领涨板块，被死狗主力拿掉，直接导致市场缺乏人气及赚钱效应！原本是近期热点，领涨板块，被死狗主力拿掉，直接导致市场缺乏人气及赚钱效应！,-1
27532,节前的阳线10.66，实际确定了2017年光线高度！本人是持这样的观点的,1
27534,光线就是垃圾中的垃圾，都不去看他们的电影光线就是垃圾中的垃圾，都不去看他们的电影,-1
27543,大闹低口碑烂片，光线至少补跌20%跌死,-1
27545,我的股票买一个滴一个怎么办！怎么办？背死啦！,-1
27553,此股已死，有事烧纸喃无喔弥陀佛，早死早超生,-1
27557,被套的人，对这股生无可恋，可见这股不得人心。被套的人，对这股生无可恋，可见这股不得人心。,-1
27561,这股怎么啦，创业办跌，它跌，创业办涨它也跌，求高手指教这股怎么啦，创业办跌，它跌，创业办涨它也跌，求高手指教,-1
27562,守着光线传媒过了两个春节，尼吗还是负23个点，什么市场啊？！！！守着光线传媒,-1
27564,光线不值钱呀，跌到6块吧光线不值钱呀，跌到6块吧,-1
27575,明天继续ipo盛宴，新丽的脚步越来越近了[兴奋]明天继续ipo盛宴，新丽的脚步越来越近了,1
27586,现在卖出，8元接回，切记切记,-1
27592,此股无药可救天天跌11块跌到现在去死吧此股无药可救天天跌11块跌到现在去死吧,-1
27596,看见了吗，已经有人见势不妙卖出了，10万股后面又一个20万股，又有一个,-1
27600,光线传媒:关于电影《从你的全世界路过》票房的公告公告日期：2016-10-18证券代码：300251证券简称：光线传媒公告编号：2016-091[查看历史公告]提示：本网不保证其真实性和客观性，一切有关该股的有效信息，以交易所的公告为准，敬请投资者注意风险。,1
27611,这股就是要完蛋的走势。这股就是要完蛋的走势。,-1
27613,长田不长命，光线坑人钱绿帽短田,-1
27626,该涨不涨，明天暴跌跌死,-1
27627,今天光线不跌停，我吃屎我是真正的男人，光线不跌停，我吃屎，跌停你们吃屎，敢赌不，,-1
27640,尼玛，贱逼股尼玛，贱逼股,-1
27646,好便宜，好便宜，,1
27654,逃命要紧逃命要紧,-1
27661,垃圾垃圾,-1
27663,买入9.83OK买入9.83OK,1
27668,长田不长命，光线坑人钱！整天吹什么传媒龙头，就是坑散户的钱，去华谊捧场！,-1
27670,最后成交一单是什么意思最后成交一单是什么意思,-1
27678,你妈又开始压盘，都没人买，你压什么你妈又开始压盘，都没人买，你压什么,-1
27679,狗养的主力，尼玛还有多少股要卖？狗养的主力，尼玛还有多少股要卖？,-1
27682,真系垃圾啊真系垃圾啊,-1
27685,一跌到底，牛垃圾股,-1
27688,不明白光线咋个了，大盘涨了都不涨，业绩也不差啊，买了个假股不明白光线咋个了，大盘涨了都不涨，业绩也不差啊，买了个假股,-1
27694,早就告诫你们，所谓光线元宵行情是骗人的，你们不信，死抱着傻了吧,-1
27699,长田不长命，光线坑人钱！一年无回报，业绩靠嘴吹！,-1
27701,坑人呀坑人呀,-1
27728,长田不长命，光线坑人钱！绿帽短田，天理不容！,-1
27738,最近王老板微博上都在赞猫眼，估计2016年业绩不错，前段时间已经做了业绩关联，期最近王老板微博上都在赞猫眼，估计2016年业绩不错，前段时间已经做了业绩关联，期待公告,1
27745,宝强效应果然很强宝强效应果然很强,1
27749,2月3日问董秘，至今未回复，估计该公司所有人都Si光光了，投机者们快跑，不久的将2月3日问董秘，至今未回复，估计该公司所有人都Si光光了，投机者们快跑，不久的将来该公司股价要归零的,-1
27752,如果阿里宣布大幅增持光线传媒，那？不知道股价会怎样走？,-1
27754,脸皮厚没救还好用了一个月清空此垃圾脸皮厚没救还好用了一个月清空此垃圾,-1
27755,电影产业已经没有市场了，现在很多小传媒太多了，电影产业已经没有市场了，现在很多小传媒太多了，,-1
27756,大家快去王长田微博上看！马云给长田发微博了！大家别忘了给马云点赞啊！！！马云牛逼大家快去王长田微博上看！马云给长田发微博了！大家别忘了给马云点赞啊！！！马云牛逼！,1
27758,快跌一年了[不赞][不赞][不赞]快跌一年了,-1
27762,好，继续幸亏把持住，好，继续幸亏把持住，,1
27767,一片绿油油，无话可说一片绿油油，无话可说,-1
27775,哈哈哈哈，太好了哈哈哈哈谭石海被抓了哈哈哈哈哈哈哈哈，太好了哈哈哈哈谭石海被抓了哈哈哈哈,1
27776,已经到了恐慌杀跌的时刻，看谁比谁蠢，看谁比谁怕！看基金那个更可恶！[困顿][困已经到了恐慌杀跌的时刻，看谁比谁蠢，看谁比谁怕！看基金那个更可恶！,-1
27811,几家民营银行的泡沫式上涨会毁掉整个市场几家民营银行的泡沫式上涨会毁掉整个市场,-1
27813,不再多说好自为之不再多说好自为之,1
27830,入股猫眼将是光线继入股先看网之后的又一败笔！入股猫眼将是光线继入股先看网之后的又一败笔！,-1
27844,悲叹，10块成为新的顶悲叹悲叹,-1
27847,已经割肉，血流成河了。已经割肉，血流成河了。,-1
27858,好比再融资政策前面抢跑的赢了后面就输了依然还是政策市管制市好比再融资政策前面抢跑的赢了后面就输了依然还是政策市管制市,1
27880,没用了9.79就是今天的高点,-1
27888,失望失望,-1
27899,都是假象还故作不痛不痒不牵强　　,-1
27914,厉害了，逆大盘暴涨0.4%，感人百年不遇,1
27922,明天完蛋了………………完蛋了完蛋了外围跌成狗，利空一大堆[亏大了][亏大了][亏明天完蛋了………………完蛋了完蛋了外围跌成狗，利空一大堆,-1
27938,厉害了，逆大盘暴涨0.4%，感人厉害了，逆大盘暴涨0.4%，感人,1
27946,先站好10.03先好吗先站好10.03先好吗,1
27948,从来没见过这么垃圾的股直接就是个渣,-1
27952,如此垃圾！如此垃圾！,-1
27957,今天如果低开，或者平开。这票就没戏了，高开走出一波行情，光线春天就来了！大家拿好今天如果低开，或者平开。这票就没戏了，高开走出一波行情，光线春天就来了！大家拿好筹码！,1
27977,为什么业绩很优秀也不涨呢？为什么业绩很优秀也不涨呢？,1
27981,赶快买进，收盘准备怒涨一分一分啊，一分，赶紧下手,-1
27982,华谊兄弟已经反转，长田绿帽还在头上！长田不长命，光线坑人钱！！！,-1
27985,业绩虽好！可是庄家不看好，我们小散跟着受罪！！！！！！！！！！！！！业绩虽好！可是庄家不看好，我们小散跟着受罪！！！！！！！！！！！！！,-1
27999,传媒里的垃圾，资本市场的毒瘤！长田不长命，光线坑人钱！！！,-1
28007,这股走的太差了，还不如华谊，都赶超光线一块钱了这股走的太差了，还不如华谊，都赶超光线一块钱了,-1
28019,垃圾垃圾,-1
28033,不看好光线的原因！不喜勿骂！发表自己看法讨论！1、华谊32到现在11，光线19到现在10，还得补跌！,-1
28034,这股太让人伤心了这股看的太让人伤心了,-1
28037,光线.你他妈快点发射哦!等不住了！[献花]光线.你他妈快点发射哦!等不住了！,-1
28043,不排除利益输送或内幕交易的可能也是大手大脚,-1
28053,中国的影视从此不值钱了，6块6块6块中国的影视从此不值钱了，6块6块6块,-1
28062,又开始骗散户接盘了,-1
28078,2017年“主要抓上市公司质量”恐怕很难落到实处了这是A股市场的一个重大利好,-1
28084,上午好好的捨不得出幸亏抛了，回来看看兄弟们，加油！,1
28091,我真傻，真的，我还以为幸亏忍住了木割。,-1
28093,集合竞价没进郁闷死了.........下午可能要跳水，都是小单接,-1
28095,升套中！搞的不爽。解套难呀！谁能帮忙解套！升套中！搞的不爽。解套难呀！谁能帮忙解套！,-1
28106,影视股都完蛋了，6块影视股都完蛋了，6块,-1
28126,估计新丽是坑估计新丽是坑,-1
28127,有戏了有戏了,1
28135,卖就卖嘛，搞什么假买实卖的单子卖就卖嘛，搞什么假买实卖的单子,-1
28138,光线就是一个坑，谁跳谁知道有多深，我杀他的心都有，光线就是一个坑，谁跳谁知道有多深，我杀他的心都有，,-1
28143,长田不长命，光线坑人钱！绿帽长田，永远走在华谊后面捡垃圾！,-1
28144,2个月了，还是王八股，你到是跌到9元啊，砸王八,-1
28146,9.9今天买个套，坑9.9今天买个套，坑,-1
28166,垃圾就是垃圾得跌到7块吧垃圾就是垃圾得跌到7块吧,-1
28198,塞翁失马焉知非福？砸盘的狗比散开！！！,-1
28199,换手率到了冰点，难道真的是:没有买卖就没有伤害吗？换手率到了冰点，难道真的是:没有买卖就没有伤害吗？,-1
28208,你也加油，这波洗干净了看见都在叫跑，我果断又加仓了，,1
28214,看看吧！看看吧！心太小了！谁能帮我变大！砸盘的狗比散开！！！,-1
28215,哈哈哈哈哈哈哈哈,1
28227,哎，前几天不敢买，早知道割了看看吧！看看吧！心太小了！谁能帮我变大！,-1
28230,突然收红，是不是哪位哥一生气发飙了呀[微笑]突然收红，是不是哪位哥一生气发飙了呀,-1
28232,妈的，破股，垃圾妈的，破股，垃圾,-1
28236,我只会埋伏你!我只会埋伏你!,-1
28239,今天尾盘怒拉两分，神马情况今天尾盘怒拉两分，神马情况,-1
28243,挂9.69没想到出了！哈哈哈哈，会不会t飞了！我哩个草！挂9.69没想到出了！哈哈哈哈，会不会t飞了！我哩个草！,-1
28249,哎，前几天不敢买，早知道割了哈哈哈漂亮崩盘了哈哈哈,-1
28251,春天来了，温暖还属于昔日大哥猫眼电影吗？随着天气的逐渐转暖，2017年中国电影光线传媒,1
28270,这货就是自己玩自己，弃坑了！这货就是自己玩自己，弃坑了！,-1
28282,亏大了亏大了,-1
28286,股票的流通盘是固定的增量资金不足的同时IPO大扩容却仍持续不断,1
28297,垃圾股垃圾股,-1
28305,光线传媒:2016年度业绩快报公告日期：2017-02-27北京光线传媒股份有限公司[查看历史公告]提示：本网不保证其真实性和客观性，一切有关该股的有效信息，以交易所的公告为准，敬请投资者注意风险。,1
28312,看透主力吸筹马上封板不买等后悔下午可能要跳水，都是小单接,-1
28318,跟屁虫人家乐视涨四五个点，你还是平盘。暴风集团中青宝,-1
28352,大盘都跑不赢的垃圾！大盘都跑不赢的垃圾！大盘都跑不赢的垃圾！大盘都跑不赢的垃圾！,-1
28370,上就上，不上就滚下来，上就上，不上就滚下来，,-1
28371,妈个逼。1万股就是挂着不买妈个逼。1万股就是挂着不买,-1
28377,9.71的本尼玛2000股啊，亏1个半大点了，抛不抛是个问题啊,-1
28380,于是增量资金不足的同时IPO大扩容却仍持续不断,1
28382,我的股票14点44连续出现444手的卖单是什么意思放量下跌，14点44到15点44出现20笔444的卖单放量下跌，盘面语言是什么,-1
28383,永远都是股癌的市场，让我把癌症的钱都给割走了，牛逼你就大盘打压到500点！我宁永远都是股癌的市场，让我把癌症的钱都给割走了，牛逼你就大盘打压到500点！我宁愿赔进去我那400多万！大不了从头再来，'NMBA谷！！！,-1
28390,建议大家关注300207估计不错建议大家关注300207估计不错,1
28397,新丽是哪家券商做保荐人的呢？上市速度怎么这么满呀可恶呀！,-1
28401,光线这垃圾，十块钱进来的，一路阴跌死气沉沉的，其他股最起码有阴有阳，这垃圾玩意，光线这垃圾，十块钱进来的，一路阴跌死气沉沉的，其他股最起码有阴有阳，这垃圾玩意，家里死人了吗？,-1
28403,今天终于割了这垃圾3年了亏了4万多今天终于割了这垃圾3年了亏了4万多,-1
28417,清仓影视，换股人工智能，科大智能。抛垃圾,-1
28425,垃圾股，垃圾田，关门大吉继续跌,-1
28433,连续两天怒涨一分[赞]连续两天怒涨一分,-1
28438,这个光线是咋个了，谁能告诉我这个光线是咋个了，谁能告诉我,-1
28445,这股票不要买了，表现太差了这股票不要买了，表现太差了,-1
28453,我我我为什么买光线传媒见鬼了春晚[亏大了]七维科技。。。。。原来[我我我为什么买光线传媒,-1
28456,我是真服了，这个龟孙子！我是真服了，这个龟孙子！,-1
28470,光线传媒:对外投资的进展公告公告日期：2016-12-22北京光线传媒股份有限公司[查看历史公告]提示：本网不保证其真实性和客观性，一切有关该股的有效信息，以交易所的公告为准，敬请投资者注意风险。,1
28474,快退市了，这么垃圾快退市了，这么垃圾,-1
28481,垃圾股，垃圾市，都是垃圾，886垃圾,-1
28485,下午暴跌，跌死，阳痿田垃圾,-1
28486,这就是传说中的老千股！哈哈哈！这就是传说中的老千股！哈哈哈！,1
28489,跳水开始，完蛋了，关门大吉跌死,-1
28491,王八蛋照这样下去肯定两块三块为止王八蛋照这样下去肯定两块三块为止,-1
