,comment,sentiment_label
10747,坐等7.6！中报出来前会达到！下一波段5.8有支撑！！！[加油][加油]坐等7.6！中报出来前会达到！下一波段5.8有支撑！！！,-1
10761,暂时躲避光线光线走势为什么这么弱？,-1
10771,昨天又套一批，弱势不改31支撑看样子撑不住,-1
10773,今天卖掉筹码，明天要哭今天卖掉筹码，明天要哭,-1
10775,一直跌一直跌草泥马的一直跌一直跌草泥马的,-1
10781,猫眼有进展吗？猫眼有进展吗？,1
10794,心生莲花，芬芳自来心生莲花，芬芳自来,1
10796,再有两天出中报，那个抠脚大汉说做空到7.6，尼玛的你倒是跌啊，老夫8.5尚且补仓再有两天出中报，那个抠脚大汉说做空到7.6，尼玛的你倒是跌啊，老夫8.5尚且补仓，还惧你哉？,-1
10799,看看隔壁，跌的比你少，涨的比你多。。。垃圾庄家怎么不去死看看隔壁，跌的比你少，涨的比你多。。。垃圾庄家怎么不去死,-1
10803,都跌成这样了，还出现大卖单又撤单，骗散户筹码呢？都跌成这样了，还出现大卖单又撤单，骗散户筹码呢？,-1
10811,除去托单外，买盘并不活跃除去托单外，买盘并不活跃,1
10816,卖出的好机会,-1
10818,华策图形不错……估计马上封板……华策图形不错……估计马上封板……,1
10828,这垃圾还涨不过华谊这垃圾还涨不过华谊,-1
10837,站上2700，晚上大消吹牛逼！报纸也能吹牛B了……站上2700，晚上大消吹牛逼！报纸也能吹牛B了……,-1
10848,真他妈窝囊，影视板块的败类真他妈窝囊，影视板块的败类,-1
10852,光线传媒:关于控股股东部分股份质押的公告(2018/09/18)公告日期：2018-09-18[查看历史公告]提示：本网不保证其真实性和客观性，一切有关该股的有效信息，以交易所的公告为准，敬请投资者注意风险。,1
10855,光线传媒:2018年半年度募集资金存放与使用情况的专项报告公告日期：2018-08-30[查看历史公告]提示：本网不保证其真实性和客观性，一切有关该股的有效信息，以交易所的公告为准，敬请投资者注意风险。,1
10871,有狗在恶意打压有狗在恶意打压,-1
10874,这个位置做空？坐等空头破产这个位置做空？坐等空头破产,-1
10885,"光线传媒上半年净利润同比增长426%来源：中国证券网　　光线传媒披露半年报。公司2018年上半年实现营业收入720,934,418.51元，同比下降29.96%；实现归属于上市公司股东的净利润2,107,136,830.07元，同比增长426.05%；实现归属于上市公司股东的扣除非经常性损益后的净利润225,981,158.92元，同比下降38.00%；基本每股收益0.72元/股。（来源：中国证券网2018-08-3003:34）[点击查看原文]",1
10888,快跑，上午拉得太快了，下午必跌，一看就是主力机构在拉高出货。快跑，上午拉得太快了，下午必跌，一看就是主力机构在拉高出货。,-1
10902,光线传媒的投入是稳定的，加大投入近期肯定影响点净利润，后面收入收益可期，阿里，腾光线传媒比亚迪,1
10918,我提出了一个问题。,-1
10947,热烈祝贺股东和合作伙伴美团香港上市股东强大公司就强大,1
10951,卖出手都很大，感觉主力还在砸盘卖出手都很大，感觉主力还在砸盘,-1
10958,做空那傻逼不是说中报出来跌倒7.6嘛？你他嘛倒是跌啊？装的太像逼容易被操了！靠做空那傻逼不是说中报出来跌倒7.6嘛？你他嘛倒是跌啊？装的太像逼容易被操了！靠,-1
10959,大资金又跑了[大笑]大资金又跑了,1
10960,这股让我亏了20000多，幸亏前两天跑的快，死王八都不出来增持下这股让我亏了20000多，幸亏前两天跑的快，死王八都不出来增持下,-1
10967,美团已经上市的，你怎么还没反应呢？至少要来个5%，给点面子吧美团已经上市的，你怎么还没反应呢？至少要来个5%，给点面子吧,-1
10974,垃圾股赶紧退市吧草垃圾股赶紧退市吧草,-1
10980,光线传媒:关于公司部分股东股份增持计划实施完毕的公告公告日期：2018-08-30[查看历史公告]提示：本网不保证其真实性和客观性，一切有关该股的有效信息，以交易所的公告为准，敬请投资者注意风险。,1
10994,啦啦啦德玛西亚自己看我发帖记录去不和你们托争辩啦啦啦德玛西亚自己看我发帖记录去不和你们托争辩,-1
10996,营业收入几个亿，盘子近30亿[大笑][大笑][大笑]营业收入几个亿，盘子近30亿,1
11018,光线传媒:2018年半年度报告摘要公告日期：2018-08-30[查看历史公告]提示：本网不保证其真实性和客观性，一切有关该股的有效信息，以交易所的公告为准，敬请投资者注意风险。,1
11023,真尼玛的垃圾，ctm快被气死了真尼玛的垃圾，ctm快被气死了,-1
11032,萨比央视拿着版权不播比赛萨比央视拿着版权不播比赛，拿了金牌央视就去当马后炮？微博删评论，你也心虚？你不会删评论删到手抽经了吧？还有就是以电竞的名义骗APP下载量，这是什么企业？,-1
11041,刮目相看,1
11056,买了股票的都去看看电影，支持公司的生意，这样你买的股票收益才会更好。你看电影的花买了股票的都去看看电影，支持公司的生意，这样你买的股票收益才会更好。你看电影的花费将10倍反馈到股票收益中。,1
11061,更看好分众传媒，该股近期处于调整行情当中，股价连续跌破多条均线支撑，目前已到了前期低点位置，短线调整基本到位，回调不破8.25可逢低建仓，目标价设在11元，预计...,1
11079,见证这一刻[加油][加油][加油][加油]见证这一刻,1
11085,看到这么多唱多的，我就放心了看到这么多唱多的，我就放心了,-1
11086,"这时候“光粉儿们”更要,心生莲花,芬芳自来,随缘随喜,欢喜度日!这时候“光粉儿们”更要,心生莲花,芬芳自来,随缘随喜,欢喜度日!",1
11088,"这时候的“光粉儿们”更要,心生莲花,芬芳自来,随缘随喜,欢喜度日!这时候的“光粉儿们”更要,心生莲花,芬芳自来,随缘随喜,欢喜度日!",1
11100,9.6的本，割肉完毕，你再也不会出现在自选里了，垃圾，垃圾的狗东西9.6的本，割肉完毕，你再也不会出现在自选里了，垃圾，垃圾的狗东西,-1
11109,传媒，演艺界多事之秋，不知道哪里就埋雷了，行业整顿时，不动这个板块。传媒，演艺界多事之秋，不知道哪里就埋雷了，行业整顿时，不动这个板块。,-1
11128,光线现在越跌越买……不怕套[胜利]害怕的空仓过节等着节后抄我们的底[胜利]光线现在越跌越买……不怕套,1
11132,美团破发……趁着利空干！美团破发……趁着利空干！,-1
11141,我要快被光线恶心死了永远的垃圾我要快被光线恶心死了永远的垃圾,-1
11144,臭傻逼臭傻逼,-1
11157,权重蓝筹疯涨，光线这姿势算什么几把玩意！,-1
11158,明天看来低点有机会接回来[胜利]明天看来低点有机会接回来,-1
11165,真是无语了，自选股里最烂的一只，气吐血了真是无语了，自选股里最烂的一只，气吐血了,-1
11192,光线传媒09月04日资金揭秘今日光线传媒主力净流入额达2662.18万元8.87%1532.645.22%1129.53万元3.84%光线传媒类型流入(万元)流出(万元)超大2609.65-1077.01大单6509.83-5380.30中单11452.66-12768.07小单8810.49-10157.26资金解读光线传媒3.79%今日成交密集时间集中于，区间涨幅0.05%，区间成交均价8.54，区间成交量占当日成交量的47.03%，区间主动买入量占区间成交量的57.46%。8.65、8.67、8.66500-700、700-1000、2000-3000中单成交活跃区间统计9:31-10:008.54成交价格主买累计成交量主卖累计成交量主买占比主卖占比8.656502004054003.93%2.45%8.673784761506742.29%0.91%8.663530501621382.13%0.98%8.68296100115001.79%0.07%8.693120000.19%0.00%成交手数分布主买累计成交量主卖累计成交量主买估算笔数主卖估算笔数500-700318600131581455188700-10001438002439801442442000-300020000006701500-200001500000751000-15001035000690左右拖动表格，可查看剩余表格内容行业个股资金流文化传媒成分股主力净流入排行序号代码名称涨幅主力净流入1000681视觉中国9.99%6337.48万2300251光线传媒3.79%2662.18万3300104乐视网9.91%1640.79万4000793华闻传媒2.70%1561.96万5300058蓝色光标3.67%1449.09万数据来源:东方财富,1
11219,每天一样的套路不行啊，该过月线了！,-1
11243,想死想死,-1
11249,"大家都抵制看无耻公司的电影,让庄们自己玩儿去无耻的公司",-1
11258,"跌破8,3就这么费事吗，速度点跌破8,3就这么费事吗，速度点",-1
11261,一天全是机狗出大单阿，等的就是这根阳棒棒,1
11288,只发图，懂的自然会买。爆款，大卖。只发图，懂的自然会买。,1
11317,恭喜光线时隔两月重新站上20日线展开四季度攻势,1
11325,"又补了20000股，成本7.75了,加油又补了20000股，成本7.75了,加油",1
11364,光线传媒华谊兄弟一样纯垃圾光线传媒华谊兄弟,-1
11384,出了，10元我再接回来，你妈的又不知道多少良家妇女被骗入市，多少美男子被套住了,-1
11386,半年报显示有香港方面的资金进来，你们比内地做T的基金公司有眼光多了！半年报显示有香港方面的资金进来，你们比内地做T的基金公司有眼光多了！,1
11390,电影加油诚天1919淘宝店，大学创业专卖贵州酒名茶。诚天1919——诚信者行天下,1
11442,个人看好光线传媒，基本面良好，市盈率6倍左右，估值低，具有长线投资价值，在电影市场份额也不错。该股从技术面上看，阶段性底部区域就在附近位置，可以逢低加仓，不过短...,1
11445,不是我吹，现在怎么跌我都麻木了，再跌就没钱看电影了。不是我吹，现在怎么跌我都麻木了，再跌就没钱看电影了。,-1
11449,垃圾玩意！从来不硬！垃圾玩意！从来不硬！,-1
11455,跌5个点不接是傻瓜。跌5个点不接是傻瓜。,-1
11459,光线传媒主力没能力拉上去光线传媒,-1
11473,一直满仓光线，亏的麻木一直满仓光线，亏的麻木,-1
11483,市盈率不高，业绩尚可，如果不是拿钱去救命，慢慢拿着吧。公司现金流充分。没必要悲观市盈率不高，业绩尚可，如果不是拿钱去救命，慢慢拿着吧。公司现金流充分。没必要悲观,-1
11488,都散了吧垃圾股控股公司上市不涨都很少见这垃圾猛跌割肉,-1
11509,都散了吧垃圾股控股公司上市大多都是暴涨这垃圾猛跌割肉都散了吧垃圾股,-1
11520,真他妈的不是人真他妈的不是人,-1
11522,骗子公司骗子公司,-1
11531,我是真的想死了我是真的想死了,-1
11546,光线传媒:关于控股股东部分股份质押的公告(2018/09/07)公告日期：2018-09-07[查看历史公告]提示：本网不保证其真实性和客观性，一切有关该股的有效信息，以交易所的公告为准，敬请投资者注意风险。,1
11547,底部？该不该买入？市盈率这么低！底部？该不该买入？市盈率这么低！,-1
11551,失望到极点……妈的B失望到极点……妈的B,-1
11575,这股就是出来害人的，十块钱买的，亏七八千跑路，这几天又跌这么惨！坑人。这股就是出来害人的，十块钱买的，亏七八千跑路，这几天又跌这么惨！坑人。,-1
11593,跳楼自杀的还没有出现，说明这还不是底部[大笑]跳楼自杀的还没有出现，说明这还不是底部,-1
11603,期待一根大阳线期待一根大阳线,1
11605,操蛋的玩意操蛋的玩意,-1
11617,光线现在越跌越买……不怕套[胜利]害怕的空仓过节等着节后抄我们的底[胜利]光线现在越跌越买……不怕套,1
11621,美团破发……趁着利空干！美团破发……趁着利空干！,-1
11630,我要快被光线恶心死了永远的垃圾我要快被光线恶心死了永远的垃圾,-1
11632,臭傻逼臭傻逼,-1
11633,感觉这股有问题，明天跑路感觉这股有问题，明天跑路,-1
11646,权重蓝筹疯涨，光线这姿势算什么几把玩意！,-1
11654,真是无语了，自选股里最烂的一只，气吐血了真是无语了，自选股里最烂的一只，气吐血了,-1
11655,错过一次卖点[失望]错过一次卖点,-1
11663,600888:新疆众和关于与特变电工股份有限公司签订附条件生效的股份认购合同暨关联交易的公告证监会广纳维稳建议沪深交易所“问计”上市公司,-1
11672,600888:新疆众和关于与特变电工股份有限公司签订附条件生效的股份认购合同暨关联交易的公告证监会广纳维稳建议沪深交易所“问计”上市公司,-1
11673,天天死阴倒阳的，要死不活的，真难受天天死阴倒阳的，要死不活的，真难受,-1
11689,光线传媒07月25日资金揭秘今日光线传媒主力净流入额达-2018.48万元-9.26%-1218.00-5.65%-800.48万元-3.71%光线传媒类型流入(万元)流出(万元)超大613.89-1831.90大单4764.53-5565.01中单8888.37-7785.88小单7294.09-6378.11资金解读光线传媒-0.20%10.05、10.06、10.08200-300、300-500、700-1000中单成交活跃统计9:30-15:009.93成交价格主买累计成交量主卖累计成交量主买占比主卖占比10.052445001749001.12%0.80%10.06243900687001.11%0.31%10.0821170000.97%0.00%10.07141300350000.64%0.16%10.093730000.17%0.00%成交手数分布主买累计成交量主卖累计成交量主买估算笔数主卖估算笔数200-30075701184612725232820300-500437967443397876887700-10005299239897753099500-7001749221583002502261000-15001000000670左右拖动表格，可查看剩余表格内容行业个股资金流文化传媒成分股主力净流入排行序号代码名称涨幅主力净流入1002624完美世界3.52%1905.36万2300058蓝色光标10.09%1754.46万3300364中文在线3.47%623.13万4300291华录百纳1.61%495.08万5000793华闻传媒2.29%423.97万85300251光线传媒-0.20%-2018.48万数据来源:东方财富,1
11704,半死不活的玩意儿！半死不活的玩意儿！,-1
11706,每天一样的套路不行啊，该过月线了！,-1
11724,加油，再来个涨停让我解套加油，再来个涨停让我解套,1
11734,。。。肯定会涨,1
11735,光线传媒:独立董事候选人声明(陈少峰)公告日期：2018-07-27[查看历史公告]提示：本网不保证其真实性和客观性，一切有关该股的有效信息，以交易所的公告为准，敬请投资者注意风险。,1
11748,光线传媒:关于拟发行超短期融资券的公告公告日期：2018-07-27[查看历史公告]提示：本网不保证其真实性和客观性，一切有关该股的有效信息，以交易所的公告为准，敬请投资者注意风险。,1
11756,哪位大神出来解读下今天晚上的公告啊哪位大神出来解读下今天晚上的公告啊,1
11758,垃圾垃圾,-1
11762,狗庄，不狡猾就不叫狗庄了。狗庄，不狡猾就不叫狗庄了。,-1
11772,光线传媒：还要再洗一百年，直到长田退休。狗日的强！,-1
11775,光线传媒:关于拟发行中期票据的公告公告日期：2018-07-27[查看历史公告]提示：本网不保证其真实性和客观性，一切有关该股的有效信息，以交易所的公告为准，敬请投资者注意风险。,1
11780,感觉第一天票房还不错啊感觉第一天票房还不错啊,1
11786,不求别的，只求你王长田稳健合法经营，对的起几万小股东。不求别的，只求你王长田稳健合法经营，对的起几万小股东。,1
11802,看到这么多人唱空，我就放心了，目标价16[微笑][微笑]看到这么多人唱空，我就放心了，目标价16,1
11806,什么情况？总收入4.01亿净利润19.9亿？？？,-1
11816,今天希望能涨停今天希望能涨停,1
11821,高开低走，要死了，要死了，烂票一张！高开低走，要死了，要死了，烂票一张！,-1
11833,少说废话，持股待涨。,-1
11834,我只能说大事件停盘前肯定跌这是套路明白不，套路2这么大的资金而且都是现金方式那绝我只能说大事件停盘前肯定跌这是套路明白不，套路2这么大的资金而且都是现金方式那绝对不是投资，而是购买资产或股份，套路3这么多钱搞事情不动脑子是你250还是你傻逼吗，套路4有空方都是有重仓位股票的，套路5说这么多了改知道干什么不，套路6.三块科技自己去联系吧。华谊是做王八王长田是做老虎。,-1
11836,开盘叫你们跑的，不跑的傻了吧开盘叫你们跑的，不跑的傻了吧,-1
11843,特么拉稀了！特么拉稀了！,-1
11871,3倍市盈率？比银行股还低？垃圾啊3倍市盈率？比银行股还低？垃圾啊,-1
11897,涨幅排行板块第60位半小时打酱油，控盘成大粪了。垃圾板块垃圾毛线。,-1
11899,什么情况啊？发生了什么？咋突然这样了？？？,-1
11916,先出了，大盘不太好先出了，大盘不太好,-1
11920,光线传媒08月01日获深股通加仓32.92万股08月01日光线传媒深股通持仓数据收盘价：9.58涨跌幅：-2.24%持股量：1265.62万股持股变化：32.92万股-5.89%-14.53%-15.82%-15.01%数据来源:东方财富,1
11929,大家小心小云补跌大家小心小云补跌,-1
11955,加油创业板破低了保祐加油创业板破低了保祐,1
11967,一出好戏成了一泻千里一出好戏成了一泻千里,1
11985,cnm！垃圾股！cnm！垃圾股！,-1
11987,10元的本，哭了10元的本，哭了,-1
11989,看下一出好戏点映评价西红柿太强了，一出好戏8.10号上演是明智的，票房是仁者见仁，希望能有惊喜,1
12005,作为买入光线传媒的股东，我用行动支持公司股价。走入影院买票看《一出好戏》。作为买入光线传媒,1
12011,又要创新低了，第一支撑位8.64,-1
12050,辣鸡股票上涨比谁都腻歪辣鸡股票上涨比谁都腻歪,-1
12051,又有傻逼出来唱多了，眼瞎啊？意淫的利好要是有用，股价会走成这样？？？醒醒吧[摊手又有傻逼出来唱多了，眼瞎啊？意淫的利好要是有用，股价会走成这样？？？醒醒吧,-1
12075,一出好戏，想表达的太多了，多少人能看懂。一出好戏，想表达的太多了，多少人能看懂。,1
12079,赵范之流祸锅殃珉已经造成了严重的影响除之后快现在都没人钻研了都去演戏了这股风必须狠狠刹住,-1
12087,光线传媒箱体已经成型箱体幅度为8.8元~13.97元，你就在这里面折腾吧,-1
12089,持股待涨，周五坚决跑出，见光死！持股待涨，周五坚决跑出，见光死！,-1
12121,媒体：8月起明星个税税率6%改为42%据有关媒体爆料，自8月1日起，影视圈执行新媒体：8月起明星个税税率6%改为42%据有关媒体爆料，自8月1日起，影视圈执行新税制，税率从原本最低6.7%左右飙升到42%，而且需按照新税制一次性补缴6个月的税款。,-1
12122,创业版最弱创业版最弱,-1
12138,一出好戏，强势涨停一出好戏，强势涨停,1
12143,垃圾垃圾,-1
12147,手上的几只票都回10个点以上了，你咱就这么慢呢？这应该是大涨的前兆吧！手上的几只票都回10个点以上了，你咱就这么慢呢？这应该是大涨的前兆吧！,-1
12151,看来一出好戏确实扑街，哎，我的错，昨天跟我买进的可以走了看来一出好戏确实扑街，哎，我的错，昨天跟我买进的可以走了,1
12156,20天均线再次向上，抢权大战正式天始！祝哽在前，祝噎在后,1
12173,狗庄狗主力，大盘这样小散帮你抬轿，你个傻逼都不拉，还压盘，你他妈怎么不砸个跌停啊狗庄狗主力，大盘这样小散帮你抬轿，你个傻逼都不拉，还压盘，你他妈怎么不砸个跌停啊，就不信你这种傻庄能获利。,-1
12178,终于快追上华测了，加油吧，光线终于快追上华测了，加油吧，光线,1
12217,人民日报都赞，相当于第二个战狼加仓,1
12220,快来看戏！快来看戏！,1
12241,今天有望过亿今天有望过亿,1
12247,艹你妹…整个传媒板块都拉了艹你妹…整个传媒板块都拉了,-1
12249,盗墓公寓石锤了！还是看好一出好戏,1
12250,估计提前15分钟突破一亿估计提前15分钟突破一亿,1
12262,首日牛逼首日牛逼,1
12276,唉，买不了创业板，只能买鹿港文化。都投资了一出好戏可鹿港不涨。唉，买不了创业板，只能买鹿港文化,1
12297,爱情公寓全面扑街爱情公寓全面扑街,1
12314,光线那个超时空拍的不错，要是拍个超时空2，可能会是一个爆款光线那个超时空拍的不错，要是拍个超时空2，可能会是一个爆款,-1
12321,光线传媒08月13日资金揭秘今日光线传媒主力净流入额达-2838.05万元-9.02%-910.99-2.96%-1927.06万元-6.26%光线传媒类型流入(万元)流出(万元)超大1083.12-1994.11大单5842.82-7769.88中单13325.34-12339.05小单10529.28-8677.52资金解读光线传媒-2.52%9.54、9.51、9.52500-700、700-1000、1000-1500中单成交活跃统计9:30-15:009.14成交价格主买累计成交量主卖累计成交量主买占比主卖占比9.54262700464000.77%0.14%9.5186200441000.25%0.13%9.5210000043000.29%0.01%9.556160000.18%0.00%9.535450036000.16%0.01%成交手数分布主买累计成交量主卖累计成交量主买估算笔数主卖估算笔数500-700336700488800481698700-10003018401485003021491000-1500205040100000137672000-300024730008201500-20001942000970左右拖动表格，可查看剩余表格内容行业个股资金流文化传媒成分股主力净流入排行序号代码名称涨幅主力净流入1300392腾信股份10.01%5370.74万2300413芒果超媒0.63%825.42万3000607华媒控股1.31%595.42万4000681视觉中国1.30%576.11万5300426唐德影视2.00%550.95万89300251光线传媒-2.52%-2838.05万数据来源:东方财富,1
12323,猫眼和淘票票的数据，一出好戏又要扑街了，实话实说！辣鸡货！还有各种雷，等着曝吧！猫眼和淘票票的数据，一出好戏又要扑街了，实话实说！辣鸡货！还有各种雷，等着曝吧！,1
12324,我提出了一个问题。,-1
12332,如果再跌就买点，业绩貌似不错如果再跌就买点，业绩貌似不错,1
12336,估计很快就有新低了，第一支撑8.64,-1
12343,加油加油加油！我行我行我行！来自光线团建加油加油加油！,1
12369,600888:新疆众和关于与特变电工股份有限公司签订附条件生效的股份认购合同暨关联交易的公告证监会广纳维稳建议沪深交易所“问计”上市公司,-1
12373,别拿票房忽悠了[微笑]别拿票房忽悠了,-1
12374,想要知道后面怎么走吗，留下想要知道后面怎么走吗，留下,1
12375,下周再下一个台阶，一周下一个台阶[大笑]动态点评：收入延续高速增长，利润同比扭亏为盈,1
12381,今天开会谈融资的事，增发算利好么？[兴奋]今天开会谈融资的事，增发算利好么？,1
12384,看看这月线走势真是太难看了看看这月线走势真是太难看了,-1
12387,什么玩意什么玩意,-1
12388,市盈率不到8倍，业绩优良，必然大涨市盈率不到8倍，业绩优良，必然大涨,1
12394,大盘红了[赞][赞][赞]大盘红了,1
12411,光线每次都是借新片利好出货，狗庄家！光线每次都是借新片利好出货，狗庄家！,-1
12420,昨天发现趋势不对。没买，今天大跌。。。[想一下][想一下][想一下]昨天发现趋势不对。没买，今天大跌。。。,-1
12425,去你妈的，死拿了，看你跌去你妈的，死拿了，看你跌,-1
12429,我就不信了，8块51买了四千股我就不信了，8块51买了四千股,-1
12440,300251大家不要买因它在创新底，只能抛,-1
12443,公司不想说点什么吗？不来点维稳措施吗？公司不想说点什么吗？不来点维稳措施吗？,-1
12473,光线传媒:2018年第二次临时股东大会决议公告公告日期：2018-08-15[查看历史公告]提示：本网不保证其真实性和客观性，一切有关该股的有效信息，以交易所的公告为准，敬请投资者注意风险。,1
12476,光线传媒08月16日资金揭秘今日光线传媒主力净流入额达-2323.12万元-7.86%-473.68-1.63%-1849.44万元-6.36%光线传媒类型流入(万元)流出(万元)超大238.38-712.06大单4247.47-6096.91中单11863.52-11283.64小单12737.49-10994.26资金解读光线传媒-4.99%8.85、8.84、8.86300-500、500-700、700-1000中单成交活跃统计9:30-15:008.64成交价格主买累计成交量主卖累计成交量主买占比主卖占比8.85797001939000.23%0.57%8.841288001180000.38%0.35%8.86706001279000.21%0.38%8.8751700428000.15%0.13%8.8860100101330.18%0.03%成交手数分布主买累计成交量主卖累计成交量主买估算笔数主卖估算笔数300-5004716167271589431454500-700178000204700254292700-1000016250001631500-200001500000751000-15000112000075左右拖动表格，可查看剩余表格内容行业个股资金流文化传媒成分股主力净流入排行序号代码名称涨幅主力净流入1002175东方网络10.03%5077.52万2000681视觉中国1.02%707.87万3600640号百控股3.34%564.36万4300431暴风集团0.27%540.57万5300688创业黑马5.16%347.85万88300251光线传媒-4.99%-2323.12万数据来源:东方财富,1
12502,今日票房将累计完成至少9个亿的目标！明后天反超今天刚刚上映的欧洲攻略！,1
12506,吃屎的光线！！！！！吃屎的光线！！！！！,-1
