,comment,sentiment_label
41301,年后数大利好。美人鱼和奔爱票房以及参投的被欢瑞世纪借壳的星美摘帽了！！！！！！！！！！！！！,1
41306,看高到200元[胜利][胜利][胜利][胜利][胜利][胜利][胜利][胜利][看高到200元,1
41307,看看吧里的预测，有些顺1.8亿最高，2字最高，你们去看看，第一天2.8亿，第二看看吧里的预测，有些顺1.8亿最高，2字最高，你们去看看，第一天2.8亿，第二天2.4字，今天又是2字头，票房是三打和澳门得总和，这才是牛逼之处，看好30亿也有可能，光线传媒,1
41308,我媳妇说，从来没见过这么挤的我媳妇说，从来没见过这么挤的,-1
41320,总票房要历史新高，行业蒸蒸日上总票房要历史新高，行业蒸蒸日上,1
41322,厦门这边票房很火爆厦门这边票房很火爆,1
41344,踏空的好多啊。都急眼了呵呵呵！！！！！！！！！！！,1
41353,30亿是梦想，可万一实现了呢？4天10.5亿全周18亿，次周10亿。30亿是梦想，可万一实现了呢？4天10.5亿全周18亿，次周10亿。,1
41364,唱空的眼都瞎了，4天10亿，前无古人，后无来者，远超速7！中国历史第一票房，都上唱空的眼都瞎了，4天10亿，前无古人，后无来者，远超速7！中国历史第一票房，都上新闻台了！,1
41367,期盼周星驰主演下一部电影期盼周星驰主演下一部电影,1
41377,各位注意“现在是有人要恶意唱空了”为什么大家好好想想！好好想想！,1
41384,16亿以下的票房300251正常分取16亿以下的票房300251正常分取,1
41387,光线传媒的票房对股价确实有所提升，不过也不要短期抱着大幅上涨甚至翻倍的想法。有几光线传媒,1
41390,热烈庆祝香港股市再次大爆跌万岁[大笑][大笑][大笑][大笑][大笑][大笑]热烈庆祝香港股市再次大爆跌万岁,1
41392,[大笑][大笑][大笑][鼓掌][鼓掌][鼓掌][鼓掌][大笑][微笑][大笑],1
41394,热烈庆祝日本股市大爆跌万万万万岁[大笑][大笑][大笑][大笑][大笑][大笑]热烈庆祝日本股市大爆跌万万万万岁,1
41395,美人鱼昨天看了，还是值得看的一部片子美人鱼昨天看了，还是值得看的一部片子,1
41409,光线不要当周星驰的冤大头，这部片子成本顶多1亿成本3.5亿，要好好查一查。多出的1亿里面至少有1亿是光线投资的。是人都看得出这部电影的成本不会比西游降魔高，西游降魔才1.3亿。,1
41411,今天票房又要2亿了，想抛的朋友请星期一竞价的时候就抛吧，我想接少少玩下，我在竞价今天票房又要2亿了，想抛的朋友请星期一竞价的时候就抛吧，我想接少少玩下，我在竞价时候接，多谢支持如果竞价是跌的，那我会接多一些，如果竞价大涨，我接少少,1
41432,还有人说等着公布10亿票房纪录的吗？15亿！真的是无敌还有人说等着公布10亿票房纪录的吗？15亿！真的是无敌,1
41436,有多少人会觉得周一涨停开盘…，举个手…[兴奋][赞]有多少人会觉得周一涨停开盘…，举个手…,1
41463,我是挺了光线，不要让我失望。全仓中。[鼓掌][鼓掌][鼓掌]我是挺了光线，不要让我失望。全仓中。,1
41472,小散如此看好，庄家是有多傻逼会给你们抬轿?做梦去吧!开盘必跌，拭目以待!小散如此看好，庄家是有多傻逼会给你们抬轿?做梦去吧!开盘必跌，拭目以待!,-1
41519,踏空的多，说明有上涨潜力和动力。明天竞价能打开买入就很不错了。,1
41530,热点追踪;寻找羊年春节最幸福的人热点追踪;寻找羊年春节最幸福的人记者问：今年过春节最幸福的事是什么？答一是领着全家去看电影《美人鱼》，二，春节前满仓持有出品并发行《美人鱼》300251光线传媒,1
41547,谁能知道光线投资美人鱼的比例，在哪里可以查到谁能知道光线投资美人鱼的比例，在哪里可以查到,1
41571,知道什么叫钦点的片子吗？好好想想吧,1
41594,见光死见光死,-1
41601,逢利好兑现，快闪吧！逢利好兑现，快闪吧！,1
41609,趁机构拿货不多砸盘，散户吃进让他白忙趁机构拿货不多砸盘，散户吃进,-1
41615,主力太垃圾主力太垃圾,-1
41619,大量抛单，这么坑？？,-1
41636,23.98买进，不知对不对买了,-1
41639,惨淡的电影市场春节放假8天，8500万人看电影，就是说每15个人才有一个人，这是市场火爆呢，还是惨淡？,1
41641,为什么资金留出，大家快跑吧，利好出货啊为什么资金留出，大家快跑吧，利好出货啊,1
41647,每天超2亿的票房冲击你们的视听！！现在不买更待何时？,-1
41664,拉光线，华谊，创业板翻红，拉创业板救主板，爆跌后的A股，安全边际高，以方宽国际资拉光线，华谊，创业板翻红，拉创业板救主板，爆跌后的A股，安全边际高，以方宽国际资金流入中国，看高光线,1
41666,地方官火热的火热生等广泛的热源绘图员,1
41671,下午收盘封涨停，明天高开继续拉升！2月份目标30元，不高吧。光线传媒,-1
41680,"涨停～～～,可以～涨停～～～,可以～",1
41686,庄在洗筹尾盘拉停哈哈哈哈[大笑][大笑]庄在洗筹尾盘拉停哈哈哈哈,1
41687,散户的力量也很强大啊,1
41705,尼天了!中午1点30美人鱼票房过2亿8天票房快21亿了截至中午1点30美人鱼票房过2亿----不信请查看http://www.piaofang168.com/,-1
41711,开盘买进了5万死了开盘买进了5万死了,-1
41722,"冲高回落,危险!走人!冲高回落,危险!走人!今天进入的,估计明天要套了!",-1
41728,今天好多股都涨停的，这有大利好还是热门概念的却没涨停难说啊，怎么回事，我减了一半了,1
41747,热烈庆祝香港股市大爆跌[大笑][大笑][大笑][大笑][大笑][大笑][大笑][热烈庆祝香港股市大爆跌,1
41769,统计下，有多少人看过《美人鱼》，看过的点赞统计下，有多少人看过《美人鱼》，看过的点赞,1
41776,难道一个涨停都不值？难道一个涨停都不值？,-1
41784,整个影视的上升空间打开了，以后票房会有50亿，100亿的；况且还有很多投资收益。整个影视的上升空间打开了，以后票房会有50亿，100亿的；况且还有很多投资收益。还是可以拿的，不要看100倍市盈率，几年后就剩20倍以内了。再往后就是几倍了。,1
41794,机构倒手砸盘的时候，散户一定要抢不要害怕，否则后悔机构倒手砸盘的时候，散户一定要抢,-1
41796,这股啥意思这股啥意思,-1
41799,真垃圾真垃圾,-1
41800,说个光线机构等隔壁华谊二王上涨，还被小编删了，你怕个球啊说个光线机构等隔壁华谊二王上涨，还被小编删了，你怕个球啊,-1
41821,超烂的光线，奥飞动漫都涨了7个多点了！超烂的光线，奥飞动漫,-1
41823,垃圾，走啦，小赚垃圾，走啦，小赚,-1
41860,终盘报收十字星。全球股市普涨，A股跟跌不跟涨，让人不可理解。沪指高开低走，早盘继续探底在2850上方企稳，午盘震荡上行，收复2900点，终盘报收十字星。2844-3016的区域的平台整理已七天，下周将会选择方向。而5178调整以来第34周的时间之窗下周开启，或会出现真正向上的拐点，春节红包行情有望从下周正式启动,1
41862,垃圾股清仓垃圾股清仓,-1
41866,恶庄去死幸亏昨天跑恶庄去死幸亏昨天跑,-1
41875,今天加仓8000股300251，相信会大涨。美人票房突破21亿。必然会连续涨停。,1
41914,几部电影，美人鱼、白骨精比较好看几部电影，美人鱼、白骨精比较好看,1
41922,明显的出货走势明显的出货走势,-1
41924,垃圾股这垃圾，今天全清了,-1
41930,看过《美人鱼》，觉得好看的点赞看过《美人鱼》，觉得好看的点赞,1
41935,你妹的怎么不怎么涨？？？你妹的怎么不怎么涨？？？,-1
41947,你妹有美人鱼还介样！没美人鱼咋整你妹有美人鱼还介样！没美人鱼咋整,-1
41952,新丽傳媒巜女醫明妃傳》开播，很好看！光线后劲会很好！新丽傳媒巜女醫明妃傳》开播，很好看！光线后劲会很好！,1
41962,坚决抛弃与大盘背离的股，除非你是妖股坚决抛弃与大盘背离的股，除非你是妖股,-1
41963,不错，此股有前途不错，此股有前途,1
41964,就这支传媒股最没用就这支传媒股最没用,-1
41973,煞笔庄～扔了～买哪个都比这个强煞笔庄～扔了～买哪个都比这个强,-1
41990,弱爆了弱爆了,-1
42005,光线传媒，节后行情后市观点！所有人都认为的利好，一定不是利好，所有人都认为的利空，一定不是利空。天齐锂业山水文化欧比特,1
42020,持有你就是个错误表现太失望了,-1
42050,美人鱼新的票房纪录21.14亿,1
42060,麻痹破股麻痹破股,-1
42070,开盘前就是16亿，这次光线赚多少啊？季报没办法藏了吧[牛]开盘前就是16亿，这次光线赚多少啊？季报没办法藏了吧,-1
42075,此股的生气位价是25.86元，承托位置是18.52元。近日会回调整理向下行若-7此股的生气位价是25.86元，承托位置是18.52元。近日会回调整理向下行若-7%--12%的。已回你了。,-1
42080,祝贺光线终于可以从美人鱼中分票房了保本20亿后，10多个发行方可以分得20亿以后的票房的一半,1
42087,"""美人鱼""有望破记录登中国影史最高票房宝座《美人鱼》成为中国影史第三部超过20亿的电影。",1
42094,今天上会。哈哈哈今天上会。哈哈哈,1
42097,30只是毛毛雨,-1
42102,哈哈哈哈哈哈哈哈,1
42104,以前跌的时候怎么不算市值萎缩！笔者傻逼以前跌的时候怎么不算市值萎缩！笔者傻逼,-1
42111,这洗盘能力好强这洗盘能力好强,1
42114,嘿庄，太坏了,-1
42117,就算没票房，反弹也不止这高度，狗庄就算没票房，反弹也不止这高度，狗庄,-1
42136,此时买入，必有厚报[俏皮]此时买入，必有厚报,1
42155,这股不存在涨的可能性，今天跌停明天还要跌，属于节前天天涨节后补跌这股不存在涨的可能性，今天跌停明天还要跌，属于节前天天涨节后补跌,-1
42160,大多数票都在横盘出货，你们看不明白吗?真够呛了,-1
42162,坚定啊持有今天去电影院看美人鱼。不错。比其他电影人数多很多。冲25亿我认为没问题。,1
42165,猪力有种再压一周，等我满上，继续砸拉死你，哈哈哈哈哈哈哈哈,-1
42169,不好了票房卖火了股价它烂了股价还赶不及大盘的,-1
42170,庄家真会洗。真服了他庄家真会洗。真服了他,-1
42177,尾盘拉全天洗盘。散户太多。不可能涨还得等尾盘拉全天洗盘。散户太多。不可能涨还得等,-1
42178,本人决定以后只看盗版，绝对不会去影院看光线传媒的任何电影那么好的票房，连一个涨停都没有，圈钱圈太明显了，本人抵制,-1
42179,这个价位就是没有美人鱼也值得买了这个价位就是没有美人鱼也值得买了,1
42180,连续几天都在尾盘拉回，又遇见这个白痴庄9月我满仓天广消防天广消防,-1
42182,垃圾垃圾,-1
42183,美人鱼票房已经达到23亿元！到目前为止，已经达到23亿元。总票房有望达到30亿元。如果前20亿元票房中，光线能获得1.5亿收益，那么后面的10亿票房，估计还能获得1.5亿收益。一部电影就能获得3亿元净收益，非常好了，2015年一年才4亿元左右的收益。,1
42206,明天的大标题是“热烈祝贺《美人鱼》票房超越光线传媒股价”[doge]明天的大标题是“热烈祝贺《美人鱼》票房超越光线传媒,1
42226,获利盘出逃，唉获利盘出逃，唉,-1
42245,剩下500股亏了我3万多，青岛出版集团你的第一是不是弄虚作假的？剩下500股亏了我3万多，青岛出版集团你的第一是不是弄虚作假的？,-1
42246,再下穿就是60日线了没救了再下穿就是60日线了没救了,-1
42247,不要慌今天在测试熔断[偷笑]不要慌今天在测试熔断[偷笑],1
42251,已换兄弟，光线来提鞋再也不用看煞笔光线B脸了,-1
42270,现在不买光线，待到何时，最低难破27现在不买光线，待到何时，最低难破27,-1
42271,烂到没边了烂到没边了,-1
42272,长舔现在不增持等何时？骗人的如题,-1
42275,垃圾股，坐等25,-1
42277,[大笑][大笑][大笑][大笑][大笑][大笑][大笑][大笑][大笑][大笑],1
42278,[赞][赞][赞][赞][赞][赞][赞][赞][赞][赞][赞][赞][赞][,1
42286,恭喜测试熔断成功,1
42300,最高点买的，越套越深最高点买的，越套越深,1
42301,明天继续熔断，不玩了明天继续熔断，不玩了,-1
42311,火箭上天，光线下江[大笑][大笑][大笑][大笑][大笑][大笑][大笑][大笑火箭上天，光线下江,1
42332,逗比年年有，今天特别逗，一会涨停，一会跌停。逗比年年有，今天特别逗，一会涨停，一会跌停。,-1
42334,每次都完集合竞价。垃圾。跌停每次都完集合竞价。垃圾。跌停,-1
42342,去你妈的，什么玩意儿？连跌这么多天，大盘从一102，到11，人家上了十个点，这孙去你妈的，什么玩意儿？连跌这么多天，大盘从一102，到11，人家上了十个点，这孙子呢？,-1
42344,[大笑][大笑][大笑][大笑][大笑][大笑],1
42366,主力已死，有事烧纸主力已死，有事烧纸,-1
42384,注册制最快三月最慢五月。新丽追不上了。别拿新丽说事。电影见光死，别拿票房说事。那注册制最快三月最慢五月。新丽追不上了。别拿新丽说事。电影见光死，别拿票房说事。那你们拿啥意淫？我建议。大家开始吹美人鱼.吹年报吧。虽然最后还是被割。但是作为一个韭菜，是不是要活出韭菜的尊严呢？,-1
42397,天天害怕啊，每天早盘抛，下午两点多接回终于盈利了，明早不抛了，别害怕，不砸了,-1
42399,绝对是最抗涨不抗跌的股票，比华谊兄弟差远了绝对是最抗涨不抗跌的股票，比华谊兄弟,-1
42405,磨到年底……完犊子了！磨到年底……完犊子了！,-1
42412,妈的从买了这个瘟票后就天天跌真是个垃圾,-1
42413,连垃圾股都涨停，你这倒底什么情况？连垃圾股都涨停，你这倒底什么情况？,-1
42415,垃圾中的垃圾,-1
42421,股价这鸟样，王长田应该出来承诺不减持，再搞点钱增持！股价这鸟样，王长田应该出来承诺不减持，再搞点钱增持！,-1
42429,这狗日的股票好像被世界遗忘了破罐子破摔,-1
42432,要死不活的。垃圾股要死不活的。垃圾股,-1
42444,MD买了这只垃圾股心都拔凉拔凉[失望]MD买了这只垃圾股心都拔凉拔凉,-1
42449,你个垃圾你个垃圾,-1
42450,光线还不如华策，好垃圾哦光线还不如华策，好垃圾哦,-1
42466,最后的62.41万股砸盘真恶心，大家怎么看？最后的62.41万股砸盘真恶心，大家怎么看？,-1
42487,每天都坑爹，尾盘涨点，第二天一定“”爹回去每天都坑爹，尾盘涨点，第二天一定“”爹回去,-1
42489,神经病，每天涨停神经病，每天涨停,-1
42491,竞价假涨停，骗散户入市。竞价假涨停，骗散户入市。,-1
42492,这次是真的这次是真的,1
42495,A股真是垃圾欧美股市跌1个多点A股直接低开1个多点A股真是垃圾欧美股市跌1个多点A股直接低开1个多点,-1
42499,好，可以早点下班了。好，可以早点下班了。,1
42501,恭喜再次提前下班！恭喜再次提前下班！,1
42505,直接停牌到过了年后开牌好了。直接停牌到过了年后开牌好了。,-1
42506,没有补仓的幸运没有补仓的幸运,-1
42521,今天涨停是肯定的了今天涨停了是肯定的了,1
42530,都冷静点，形势好转，这个价位就买不到了都冷静点，形势好转，这个价位就买不到了,1
42533,小别半月，明日满上没有为什么，只能帮你们到这。,1
42536,昨天我说啥来，光线不拉今天肯定熔断创业板完蛋了就没戏了，明日改拉了,-1
42541,热烈祝贺暂停熔断机制！热烈祝贺暂停熔断机制！,1
42548,完蛋了，今天继续跌停完蛋了，今天继续跌停,-1
42559,逗逼么？逗逼么？,-1
42560,这SB庄家就这天天假涨停竞价这一招了吗？有意思吗？这SB庄家就这天天假涨停竞价这一招了吗？有意思吗？,-1
42562,这SB真没救了吗？熔断暴跌之前就已经跌了一星期了，暴跌一个没落下，今天好不容易都反弹了，这SB还在跌，我艹,-1
42565,今天是：换一波人套牢的游戏！今天是：换一波人套牢的游戏！,-1
42566,亏死，跌停[怒][怒][怒]亏死，跌停,-1
42583,妈的自庄己死这十来天跌了30%了[不赞]妈的自庄己死这十来天跌了30%了,-1
42590,15号上会还有可能，今天不可能,-1
42600,麻痹跌比跳井都快，涨比死猪都慢，，,-1
42602,光线传媒业绩好但近日股价确实让人失望，，,1
42615,"光线传媒(300251)融资融券信息(01-07)来源：东方财富网光线传媒(300251)2016-01-07融资融券信息显示，光线传媒融资余额2,032,009,319元，融券余额3,856,342元，融资买入额72,377,221元，融资偿还额61,925,516元，融资净买额10,451,705元，融券余量155,060股，融券卖出量0股，融券偿还量0股，融资融券余额2,035,865,661元。光线传媒融资融券详细信息如下表：交易日期代码简称融资余额(元)融券余额(元)融资买入额(元)融资偿还额(元)融资净买额(元)融券余量(股)融券卖出量(股)融券偿还量(股)融资融券余额(元)2016-01-07300251光线传媒2,032,009,3193,856,34272,377,22161,925,51610,451,705155,060002,035,865,661深市全部融资融券数据一览光线传媒融资融券数据（来源：东方财富网2016-01-0808:51）[点击查看原文]",1
42640,阿里成本是17.6元吗？阿里至少盈利20%，21元抛出。光线危险。,-1
42651,卖出就是挣到，下星期连续10000个跌停板在等着你们[大笑][大笑][大笑][大卖出就是挣到，下星期连续10000个跌停板在等着你们,-1
42654,一大早就跌成这狗样，垃圾一大早就跌成这狗样，垃圾,-1
42658,又掉，不让人活了，又掉，不让人活了，,-1
42662,光线华谊一对难兄难弟前期估值太高，现在修复，已经是底部区域，逢低吸纳，必须要板块联动，才能走出一波行情，耐心等待。。。,1
42670,不满仓，低吸高抛，继续做低吸,1
42680,我买了买了买，我快乐快乐快乐我买了买了买，我快乐快乐快乐,1
42683,调仓002343慈文传媒了这垃圾股,-1
42685,这个垃圾股这个垃圾股,-1
42687,王蛋还不增持王蛋还不增持,-1
42709,33块钱的本怎么办！33块钱的本怎么办！,-1
42712,但愿光线明天涨停，把华谊兄弟那两王八带涨起来但愿光线明天涨停，把华谊兄弟,-1
42719,知道光线为什么跌吗主要是股价太高了，不好再拉高了，所以只能打压下来,-1
42721,每天集合竞价涨停，是个sb干的每天集合竞价涨停，是个sb干的,-1
42724,恭喜恭喜涨停节奏恭喜恭喜涨停节奏,1
42732,真特么垃圾啊真特么垃圾啊,-1
42738,有人忙着建仓，有人盼着解套[赞]有人忙着建仓，有人盼着解套,1
42741,不是说要涨停吗不是说要涨停吗,-1
42742,真是只垃圾股太垃圾了,-1
42745,无语！无语！,-1
42746,光线传媒这样也跌，看来股市是真没救了！光线传媒,-1
42750,底在哪亏了13块了我去底在哪亏了13块了我去,-1
42751,真的完了吗？真的完了吗？这股越发利好越跌，看来要出问题了，华策影视,-1
42754,真服了还每天集合竞价一如既往的装装C不是,-1
42757,太垃圾了，涨时不涨，跌的时候它跌的最快。出消息就是骗散进场被套太垃圾了，涨时不涨，跌的时候它跌的最快。出消息就是骗散进场被套,-1
42761,14：28分，被一别有用心的滚蛋砸了496手把价格拉低而后集合竞价吃货!14：28分，被一别有用心的滚蛋砸了496手把价格拉低而后集合竞价吃货!,-1
42787,光线传媒大势已去啊！[亏大了]光线传媒,-1
42790,这是过年抄家的意思这是过年抄家的意思,-1
42791,盈利的，增长的，阿里成本24.22/1.3阿里成本是24.22/1.3=18.6，低于这个价，大胆进入吧，确切的说现在进就很不错了,1
42793,说估值高，至少还是盈利的，煤炭钢铁都亏损破产了一片泥泽，出不来了,-1
42800,知道天天会跌停心里反而踏实了，不用再期盼涨了知道天天会跌停心里反而踏实了，不用再期盼涨了,1
42818,这货一如既往的骗人这货一如既往的骗人,-1
42823,垃圾，他妈的集合竞价总搞涨停开，骗谁啊！垃圾，他妈的集合竞价总搞涨停开，骗谁啊！,-1
42825,真特么垃圾真特么垃圾,-1
42831,上面抛盘的逼太多！没办法,-1
42833,完了，赔100多万过年完了，赔100多万过年,-1
42835,恶心的庄，严重的恶意做空啊真够缺德的,-1
42836,本人昨天跌停进，成本22.67[不说了][不说了][不说了]本人昨天跌停进，成本22.67,-1
42840,34叫你们卖你们不卖、还说我是庄托、哎。。。34叫你们卖你们不卖、还说我是庄托、哎。。。,-1
42864,这股不行了这股不行了,-1
42872,创业板红了，光线还跌一个点，原来光线不是创业析那个跌就跟那个,1
42874,垃圾！垃圾！,-1
42879,垃圾股真是只垃圾股,-1
42894,个人猜测国家周末会出重磅利好了,1
42897,周末不出利好，股市面临崩盘！周末不出利好，股市面临崩盘！,-1
42898,光线看你还要怎样坑人！光线看你还要怎样坑人！,-1
42918,当大家都看空时果断进场，当大家都看多时果断离场[兴奋]当大家都看空时果断进场，当大家都看多时果断离场,1
42934,"什么意思?每天开盘时硬一下,然后阳萎",-1
42956,涨停天天集合竞价涨停，过瘾吧！,1
42964,"光线传媒(300251)融资融券信息(01-13)来源：东方财富网光线传媒(300251)2016-01-13融资融券信息显示，光线传媒融资余额1,873,059,562元，融券余额3,328,614元，融资买入额85,617,743元，融资偿还额147,395,769元，融资净买额-61,778,026元，融券余量154,460股，融券卖出量0股，融券偿还量0股，融资融券余额1,876,388,176元。光线传媒融资融券详细信息如下表：交易日期代码简称融资余额(元)融券余额(元)融资买入额(元)融资偿还额(元)融资净买额(元)融券余量(股)融券卖出量(股)融券偿还量(股)融资融券余额(元)2016-01-13300251光线传媒1,873,059,5623,328,61485,617,743147,395,769-61,778,026154,460001,876,388,176深市全部融资融券数据一览光线传媒融资融券数据（来源：东方财富网2016-01-1408:48）[点击查看原文]",1
42966,不得不放弃你这垃圾不得不放弃你这垃圾,-1
42986,央妈用心良苦，央妈用心良苦，,-1
42987,2:30空头会反攻，但会失败2:30空头会反攻，但会失败,-1
42994,回到30多久，很快回到30多久，很快,1
43018,连续三天开盘前挂个涨停价在那儿，坑爹呢？连续三天开盘前挂个涨停价在那儿，坑爹呢？,-1
43023,日线MACD在不断缩短，然而股价却跌了,-1
43033,万达十倍股从传奇开始！宁波敢死队强庄力挺股价万达十倍股从传奇开始！宁波敢死队强庄力挺股价,1
43035,这个股恼火这个股恼火,-1
43037,加油来个涨停加油来个涨停,1
43050,玛德开盘以为大跌就割掉了玛德开盘以为大跌就割掉了,-1
43051,[大笑][大笑][大笑][大笑][大笑][大笑][大笑][大笑][大笑][大笑],1
43057,大年初一看美人鱼大年初一看美人鱼,1
43066,昨儿涨3，今天吐4。牢骚完毕。昨儿涨3，今天吐4。牢骚完毕。,-1
43071,其实这股真的很烂其实这股真的很烂,-1
43072,疲软，被某人忽悠进来的，后悔疲软，被某人忽悠进来的，后悔,-1
43075,明天大涨，理由我先不说了明天大涨，理由我先不说了,-1
43080,跑不过大盘的垃圾货！！！！！跑不过大盘的垃圾货！！！！！,-1
43081,垃圾股简直就是只垃圾股,-1
43083,垃圾垃圾，跌了折磨多，连指数都跑不赢！！！！！！！,-1
43103,高管都急着逃命，散户买吧高管都急着逃命，散户买吧,-1
43108,华宜已经跑远了，这个还是半死不活！垃圾！华宜已经跑远了，这个还是半死不活！垃圾！,-1
43116,抄底[胜利][赞]抄底,1
43125,这个SB主力大盘好时不拉，你妈不好时想拉也拉不起来真的SB,-1
43136,回调陆续开始了，不要追高，等待买点出现看1月14日率先涨停的股票，今天还是红着的，只有4只了，大部分已经下跌回调。此时，不宜追高。,-1
43138,跟机构干！！越是跌越买！！跟机构干！！越是跌越买！！,-1
